~~Output Dialog~~|~~Respect of User (OD)~~|~~Input Dialog~~
 Top of the world? Dock of the bay?  I'm out. |5| What am I sitting on? 
 Oh! Look at that, time's up! My turn! |7| I can't believe we've never done this before! It's sooo good! So good for Monica!  
  Wow! Listen, we had a good run. What was it? Four? Five months? I mean, that's more than most people have in a lifetime! So, good-bye, take care, bye-bye then!  |6| Chandler!!! Chandler!!!  Chandler, I saw what you were doing through the window! Chandler, I saw what you were doing to my sister! Now get out here! 
 Hey! |8| Hey! 
 Okay.  |5| Okay, pick a card. 
 Hey! |8| Hey! 
 I'm sorry! |0| That is it! You just barge in here, you don't knock 
 Hi, my names Chandler. I just moved in next door and I was wondering if you would be interested in battling me in a post-apoplectic world for control of the galaxies last remaining energy source? |7| Hey. 
 Sydney Portier? Hehheh. _B_ |9|  Okay, great! Bye.  So guess whos coming to Thanksgiving dinner? 
 This coming from the man who couldnt split our 80 dollar phone bill in half.  |2| Okay Rach, that muffin and espresso, $4.50. Ross, double latte, $2.75. Chandler, coffee and a scone, $4.25. And Pheebs, herbal tea, $1.25. So, all together thats  $12.75. 
 Yeah. |6| Hey, remember when I had a monkey? 
 Ahh, Hotties of the Paleontology Department, theres a big selling calendar, eh? |3| Hey! I just got uh, my teacher evaluations! Check out what this one student wrote, "I loved Dr. Gellers class. Mind blowing lectures! Dr. Geller, you are definitely the hottie of the paleontology department!" 
 Okay. |5| Okay, Chandler! 
 Hey! |8|  Hi, you guys. 
 Hey. |8| Hey, whats going on? 
 No, no, no. No-no-no. Joey, Rachel, and |7|  Hey everybody! Happy Thanksgiving! 
 Do you realize you get louder each week? |7| Do you realize that four weeks from today were getting married? Four weeks baby!! Four weeks!!! 
 Hey.  |8| Hey. 
 New haircut?  Necklace?  Dress?  Boots?  Boots! |6| Hey! So what do you think? 
 Oh my goodness! Where did you hide it? |5| Hey! I got you a present!! 
 Hi! |9| And that's why, no matter what mommy says, we really were on a break.  Yes we were! Yes we were!  Come here gorgeous.  Oh! Look at you! You are the cutest little baby ever! You're just a... a little bitty baby, you know that? But you've got...  You've got big beautiful eyes... Yes you do... and a... and a big round belly.  Big baby butt! I like big butts.  I like big butts and I cannot lie / you other brothers can't deny / when a girl walks in with an itty, bitty, waist / and a round thing in your face you get... Oh my God, Emma... you're laughing! Oh my God, you've never done that before, have you? You never done that before... Daddy made you laugh, huh? Well, daddy and Sir Mix Alot... What? What? You... you wanna hear some more? Uhm... My anaconda don't want none / unless you got buns hon...  I'm a terrible father!  _B_ 
 Yeah. Hey! Here's an idea. Why don't we use our wedding china today? |5| Hey Hon? Would you help me get the plates down? 
 Because I told everyone he slept with dinosaurs. |4| Alright, wait a second, why would Ross tell everyone in your class that you are as...  "gay as the day is long"? 
 Hello? Oh hi, Doctor Connelly.  No, she's not here but, you know, I can tell her. Should I be sitting down for this?  Oh.  Well, so what does that mean?  Ok. Ok, thank you. Thanks.   |1|  It is not okay that I'm aroused by this now.  
 Hey! Look I brought a friend for dinner, this is Zack, from work! |6| Hi honey! 
 You know, I'd love to, but I'm a little tired. |1| Oh, the way you crushed Mike at ping pong was such a turn-on.You wanna...?  
 How did the job stuff go? |3| Previously on Friends... 
 Spanish midgets. Spanish midgets wrestling. Julie. Ok, yes, I see how you got there.  |7| Man, I sure miss Julie. 
 Alright, alright, but you better be wearing clothes when I open my eyes. |3| Alright, no peeking. No peeking, no peeking, no peeking. 
  See Joe, that's why your parents told you not to jump on the bed. Opening Credits _B_ |5|  WHOAA!! 
 You can always spot someone who's never seen one of his plays before. Notice, no fear, no sense of impending doom... |7|  Ooh! Look! Look! Look! Look, there's Joey's picture! This is so exciting! 
 I will have one.   |5| Here you go Pheebs. Who else wants one of my special homemade brownies? 
 Oh yeah, but don't worry. I don't think anybody's gonna focus on that as long as your wearing that towel dress. |5|  Okay. Hey. Umm. Does everybody hate these shoes? 
 This is the New York Times. |9| Can I see the comics? 
 Or... Dick. |9| Hey, wouldn't be cool if our duck and chick had a little baby? We could call it Chuck. 
   Hi there.  |9|  Oh, and then Monica joked that she wouldnt go out with a guy like Chandler... 
 Oh no-no-no, Im, Im paddling away! |4| Hey!! We are so in luck! Treeger said that we could have all this cool stuff from the basement. Wait right there.  
 Yeah, it was time. The old condom ring in the leather just doesnt say cool anymore. |1| Hey! New wallet, huh? 
  Hey, its me. I know you cant stand to be in the same room as me, so I just thought Id try and apologize over the phone. All I    |1|  Hello. 
 Hey! Wow, it is true what they say, pregnant bellies look like a drum. |6| Hey! 
 That's a pig. |8| No, look.  
  We're very happy for you. |9| All right! Here we go! 1999! The year of Joey! 
 Hey man, what's up? |6| Oh, yeah, good idea.  
  Yeah, see, I can't pull of baby-doll can I? |6| I'm fine, thanks. 
 First of the month. |5| Right! And when is that due? 
 Any contact? |3| She barely knows me. We just live in the same building. 
 No, I dont want to tell anybody else because I dont want Monica to find out. |1| Now, have you told anyone else? 
 So, what do you think? |4| Hey! 
 Someone on the subway licked my neck! Licked my neck!! |0| Whats the matter? 
 Its Phoebe! Hi!  |9| Theres the waitress. Excuse me, Miss. Hello, Miss?  
 betrothed couple. |8| Betrothed  
 Hey, you have got to try this cheesecake. |4|  Hi. 
 So did Monica tell you about this great band called the Swing Kings that were trying to get to play at the wedding? |5| Food? Uh-huh gimme!  
 Yep! From now on its gonna be the four of you guys and me and the mrs. The little woman. The wife. The old ball and chain. |7| Why?! Whats happening to the coffee house?!  Oh!  
  Bermuda, Bahama, come on pretty mama |1| Yeah I am! 
 Honey, you're screaming. |5|  I LOVE MY NEW JOB! 
 What? Why? |1| Dude, come home! 
 I'm not sure what they did, but I'm inclined to blame Enron. |0| I know...God. I haven't seen my savings take a hit like this since I was a kid and they came up with double-stuffed Oreos. What happened to all our money? 
 Yeah, I don't know why we hang out with married couples more often. |6| Oh! Yeah, this is fun, couples night. 
 Well it couldn't have been worse. A woman literally passed through me. Okay, so what is it, am I hideously unattractive? |0| So, how was the party? 
 Hey. |8| Hey. 
 The spoon. You licked and-and you put. You licked and you put. |6| What? 
 Why? |4| Nothin' roomie, just watchin' you sleep. 
 Yeah, but I'm, I'm so much faster... |6| Oh, I ordered mine first. 
 Okay, Im not gonna have one. |2| I will have one.   
 Well, as old as he is in dog years, do you think Snoopy should still be allowed to fly this thing? |2| What? 
 Oh, great. This is just...  Opening Credits _B_ |4| Hi. Um, I want to start with a song thats about that moment when you suddenly realize what life is all about. OK, here we go.  OK, thank you very much. _B_ 
 Tell it again.  Seriously. _B_ |4| All right, I was 15, it was my best friend, Ruth, and we got drunk on that hard cider, and then suddenly, I dont know, we were, we were making out. 
 You dont turn and slide, you throw it out! Im tired of having to get a tetanus shot every time I get dressed! |0| How many times do I have to tell you! Ya, turn and sliiiide! Y'know, turn and slide. 
 It just keeps getting worse and worse! Y'know? I mean its bad enough that Im in love with my roommates girlfriendwhich by the way, I think she knows. Because every time were in the room together theres this weird like energy between us. And call me crazy, but I think she likes me too. And now I have seen her naked. I mean at least when Ive seen her with clothes on, I could imagine her body was like covered in boles or something. But there are no boles, shes smooth! Smooth!   |1| Y'know if we ever go to war and youre captured, youre in for a big surprise. 
 Our eyes are closed and were about to cross the street. Very good. |8| Come on, no peeking!  
 I know!!  |4| People can hear you. 
 Thats a mailman! Thats our mailman!   Hi. How are ya? |9| Chandler, theres a guy right over there.  
 Treegers snaking the shower drain. Mr. |3|  What is that? 
 Uhh, 9.  |6| Monica? What time is it? 
 Aren't you supposed to be at an audition for another hour? |1| Look, just because I know about you two, doesn't mean I like looking at it. 
 It's your timer.  |8| That was a half an hour? 
 Oh, I'm going on the lamb. |3| What are you doing?! 
 Oh yes. |7| All right now, memorize it.  You got it? 
 Monica and I are celebrating our ten-month anniversary, we've got reservations at Ja George. |4| Wow! You look nice. What's the occasion? 
 Rachel, wait, wait. |6| You have no respect for anybody's privacy! 
 What? |4| When?! After the birth of our first secret child?!  Ross didnt get the annulment; we are still married. 
 So, is Janine around? |3| Sure, neighbor come on in. 
 Oh! Thats great, they havent seen the place since I moved in! _B_ |5|  I miss Rachel.  No, my parents. 
  Oh, well thank you in advance.  |9| And your horoscope says, "On the fifth a special someone is going to give you a gift." 
 Okay, well tonights the big night. |7| Yeah, you didnt get one. 
 Okay, let me just straighten out your helmet there.  |6| Uh-huh! 
 I figured Id buy those. Pat, Id like to buy a vow.  |6| Theres still so much to do. Have you written your vows yet? 
 Yknow uh, I didnt actually do this. |5| Oh my God! You cleaned!  Look at these floors! You did the windows! Oh, I have been begging you for months and you did! You cleaned! And nagging works! 
 Oh my God! |4| Yes! Now, theyre a little more than I normally spend on boots or rent  
 Pheebs you didnt have to get us anything for our wedding you already sang |9| I got it for your wedding and I ordered it weeks ago, and it finally got here! 
 How come? |3| Hey... hey listen... What do you guys know about investments? 
 Honey, she keeps cancelling on us...Take the hint! |4| No, I think we should save our china for something really special...Like, if the Queen of England comes over. 
  Say goodbye elves, I'm off to Tulsa. |4|  Uh-huh. 
 Would you get that please? People have been calling to congratulate me all day. |6| But that's clearly a joke. This could easily be true.  
 Doctor Connelly just called. |3| Hey sweetie. 
 You're on!  |5| I'll put a pillowcase over my head. 
 Relax! We'll just get her some antacids. |1| Oh my God! 
 Relax! We'll just get her some antacids. |1| Oh my God! 
 I broke up with her. |2| So how was Joan? 
 No, see, I'm trying this new screening thing. You know, I figure if I'm always answering the phone, people'll think I don't have a life. My god, Rodrigo never gets pinned. |0| You ever figure out what that thing's for? 
 Uh, if I were omnipotent for a day, I'd.. make myself omnipotent forever. |0| Yeah, see.. you took mine. Chandler, what about you? 
 Believe me, sometimes that happens. MRS |3| If you didn't pour the coffee, no one would have anything to drink. 
 Well, I'm guessing he wants to do a little dance. . . ya know, make a little love. . . well pretty much get down tonight. |3| Oh really? What uh, what does he want with her? 
 Sweet mother of all that is good and pure. |9| Alright open your eyes. _B_ 
 We can? All right, I'm tryin' that. |9| Come on! You guys can pee standing up. 
 If I was a superhero who could fly and be invisible, that would be the best. |3| Oh good, another dinosaur story. When are those gonna become extinct? 
 I like her. |6| Oh-ho yeah! A song with rhyming words. Oo, I never thought of that before. 
 Wow! Really?! We get all this rusty crap for free?! |6|  Huh?! 
 Ross and the most beautiful girl in the world. |9| Hey what are you guys looking at? 
 Look I never should have kissed your girlfriend, but Im    |3|  Hello. 
 Wow! She looks great. Doesnt she? |8| I know!!  
 All right. |5|  Ha-ha.  No, its just Im so pregnant that Imy guitar doesnt fit anymore. So I thought til Im not, Im just gonna play all my songs on this drum. It sounds really cool! 
 Hey!  |8| I know, I know, but look at the knobs on her.  
 We wanted to kiss at midnight, but nobody else is going to so y'know |2| What's the matter?! 
 And we're done with the chicken fried rice. |7| Ohh, I'm gonna miss that big old squishy butt. 
 Oh, we wanted to finish the crossword before we went to bed. Hey, do you know a six-letter word for red? |6| What are you guys doing up? 
 Okay.  |5| No. I think we learned that from the sugarlips incident. I'm gonna get some tea. 
 No, just the months you actually want to live here. |3| And thats every month? 
 Im good. |9| Joey we know you steal our food.  
 Twenty percent is a pretty generous tip Joe. |3|  Hey! So, whats with the 20 percent tip? Did I do something wrong? 
 Well, its because I trust you, youre one of my best friends, and you walked in on me when I was looking at ring brochures. |4| You told me. 
 What are you guys doing? |8| Oh Willies still alive! 
 No, we're playing this game I learned at work. You have to name all the states in six minutes. |5| What, are we keeping Thanksgiving a secret this year? 
 Wait, wait! Wh-what are you doing here? |2| Hi. Okay, will that be all? 
 Hey! Rachel and |9|  Hey! 
  It was at the front door. When I got home. Somebody sent it to us. |1| Oh, yknow I'm not that much of a sweet tooth. IWow. My God, so creamy. Oh my God, this is the best cheesecake I have ever had. Where did you get this?  
  Monica said wedding. |2| Yeah, its just yknow 
 Oh since forever! I used to go all over town listening to bands! |6| Since when are you into swing music? 
 The young hot ball and chain. |5| Old? 
  Hi! Were checking out of the bridal suite. |8| No.  I was told the name of the movie would not appear on the bill!  
 Are you, are you high? |7|  Hi. 
 Look, I cant. Whats going on? |2| Come home! 
 Maybe I should quit and get a job that pays. |1| I guess with you doing the internship, we're just spending more than we're bringing in. 
 You guys haven't actually met before, but, boy! You're both polite!  Go to have a seat Zack, and I'll get you a beer. |8|  You too. 
 Yeah. We don't feel like we can host Thanksgiving this year. |4| We need to talk to you about something. 
 So, where's Mike? |0| Oh! 
 You mean that Portuguese couple? Yeah, like you wouldn't have done it.  |3| Well, because every time we do, you make jokes about swinging and scare them away. 
 You know, it's...  something funny about sneakers. I'll be right back.  |2| I guess so.  
 You know, I once dated a Miss Crankypants. Lovely girl, kinda moody. |3| Don't be silly. Ben loves you. He's just being Mr. Crankypants. 
 Woah, woah, I've put on a little weight? |7| No, you are not, you are very attractive. You know what, I go through the exact same thing. Every time I put on a little weight, I start questioning everything. 
 Well don't you see how gross that is? I mean that's like you using my toothbrush. _B_ You used my toothbrush? |1| Yeah, so. 
 I can't sleep now. |0| Makes me feel um, peaceful, heh-heh, please. 
 No. |4| Give it to me. 
 All right, I suppose I can wait a day. Hey, what are you doing Friday? |7|  It's her first day at this new job. Your not supposed to start with her! 
 We are. Hes meeting us here. |7| Guys. I thought you were taking Ross to the game? 
 All right, how about we, how bout we sell it. |6| Look, were not throwing it out! I built this thing with my own hands! 
 You! |8| What is that noise? 
 Hey, you know who used to have nails like that? |6| Chandler, dont worry! This doesnt make you any less of a guy!  That does!  What am I sitting on?  I hate to think what this woman was scratching when this broke off. 
 Wow! Pregnancy does give you some weird cravings. _B_ |9| God! Ooh! What is that smell? Its coming from the bathroom. Ooh!  
 Yeah, I think for us, kissing is pretty much like an opening act, y'know? I mean it's like the stand-up comedian you have to sit through before Pink Floyd comes out. |5| Absolutely. 
 Well, they're Joey's! They gotta be Joey's!  |9| Well, they're not mine! 
 All right, then massage me up right nice!  |7| Y'know, I don't like to brag about it, but I give the best massages! 
 And, we're done with the yogurt.  |9| Ooh, this is cool...it says in some parts of the world, people actually eat the placenta.  
  Yes.  |6|  Is that your card?  
 Made a few calls, pulled some strings, and they agreed to seat us at 1130 if we both had the chicken and didn't get desert.  Delivery |0| Wow! How'd you get in there? 
 Hiya doin' pumpkin? |9| Okay.  
 Oh, Richard. That's all I ever hear, Richard, Richard, Richard! |5| Richard? I'm not gonna go see your ex-boyfriend! 
 Can I just say one thing? |4| No, you wait! This is ridiculous! 
 Can I check out what she did to my room? |2| Uh, no, shes at dance class. 
  Why cant I tell them that we live together? |5| Yeah, and yknow, if you could not mention to them that we live together, that would be great! , I was thinking we would eat around four. _B_ 
 That is funny. It was also funny when I made it up. |5|  Here, check it out. Its the first one, too.  
 Monica and I are engaged. |8| Whats up? 
  Shes not as pretty as she was when she was 29. |1|  Hey. 
 Right. So uh, have you written yours yet? |3| Sweetie, you know I have no sense of humor when it comes to the wedding. 
 No, it wasnt you. |5| Oh no, was I cleaning in my sleep again? 
 Im gonna miss being able to afford food. |1| I know. 
 Hey! |8| Hey! 
 Oooh, did he put a little starch in your bloomers?  Who said that? |9| Well, his name is Parker and I met him at the drycleaners. 
 Hey. |8|  Hey! 
  Oh, that's great. |7| twice as big as Allessandro's. 
 What is the point of having them, if we never use them? |2| What if something gets broken? They're so expensive! 
 Wow, what a geek. They spent $69.95 on a Wonder Mop. |1| I think when someone steals your credit card, they've kind of already thrown caution to the wind. 
 Hang up, hang up. And that was a great movie!  I'm so gonna get back at Ross... oh yeah, this will show him, here we go . |4|  Hello? No, he's not here. Yeah, this is his wife. Yeah, well, it came as quite a shock to me too. I guess I should have known. Yeah, I mean, he just kept making me watch Moulin Rouge. 
  Hey, there's two messages. These could be from work! |2| As a matter of fact she said that's how I am going to die.  So, excuse me for being a little skittish. 
 Actually it's both of us. |3| With good news?  Of course it is not good news, you just said  "Doctor Connelly just called". If it was good news you would have said  "Doctor Connelly just called! " But so what is it? Is there a problem, uh? Is there a problem with me or with you? 
 That's why our honeymoon photos look like me and Diana Ross! |7| Ok! When I go places with high humidity, it gets a little extra body, ok?! 
 That's why our honeymoon photos look like me and Diana Ross! |7| Ok! When I go places with high humidity, it gets a little extra body, ok?! 
  Seriously, answer faster! |5|  Sex! 
 Oh my God! _B_ |4| She doesn't have a stomach-ache. She's in labor! 
 Oh my God! _B_ |4| She doesn't have a stomach-ache. She's in labor! 
 They were huge. When she sneezed, bats flew out of them. |8| Dont tell me, because of the big nostril thing? 
 Yeah, we were gonna give fifty, but if you guys gave more, we don't wanna look bad. |5| Hey, how much did you guys tip the super this year? 
 Congratulations! |9| Huh? Days of our Lives picked up my option. 
 All right Ill have one.  |5| No, no, its just my tooth. 
 Well, thats pretty much all Im looking for from these people. |4|  Why? Because she can sing and play guitar and do both at the same time? 
 Oh come on man! At least let me finish this last one. |2|  Oh, no-no, no-no-no, theres none of that in here. 
 Was it like a sneeze only better? |3| Listen, I-I need a favor. Umm, I was in the shower, and as I was cleansing myself, I ah, I-I, well I felt something. 
 Could we be more white trash? Opening Credits _B_ |1| Uh-huh. This and a bunch of bubble wrap. And, some of it is not even popped!  
 Hey! |8| Maybe he found you flip-flop.  
 What?! |3| Emily's cousin kicked me out! 
 Ah! Ahh!! Ahh!! |9| All right, then massage me up right nice!  
 Yeah, I think that's wrong, but there's a Connect the Dots in here for you later.  Hey, how about maroon? |4|  Dark red. 
 Oh my God! |4| Whoa! 
 Okay, here is the phone bill.  |1| Ahhh. 
 I see where youre goin! |6| Yknow whats more generous than that?! Fifty percent! Yknow whats even more generous than that?!! 
 Me too.  |9| Yeah well, once again not knocking pays off. I only wish you hadnt been on the toilet. 
 It is going to be perfect. I am taking her to her favorite restaurant. Im going to get her a bottle of the champagne that she really loves; therefore knows how expensive it is. Then when the glasses are full, instead of proposing a toast Im just gonna propose. |7| Okay listen, how are you gonna ask her? 
 Whats the matter honey? |3|  Oww! 
 Are you kidding? Okay, Ill give you a hint; Ill give you a hint.  |3| What? 
 Its your mommy. Its your mommy. |7|  Hello?  Hold on please. Joey, its your mom.  
 Oooh, Im afraid that does not exist. |2| Oh, my mom called, theyre gonna run our engagement announcement in the local paper, so were looking for a good picture of us. 
 Now, that's a lot harder than it sounds. You always forget at least one, or in some cases... fourteen . |5| What? That's like insanely easy! 
 Okay. Okay. |1| No-no, one daddy, two mommies. All right, its all yours.  
 Ino! I didn't read the box before I opened it. And you can't return a box after you've opened the box. |0| Chandler, this is not addressed to you. This is addressed to Mrs. Braverman downstairs.  Thief. 
  Thats a plane! |4|  There it is! Oh, look at that! Isnt Mother Nature amazing? 
 Gap commercial.  So did you book them? Did you call? |1| Chandler. 
 And Im the happiest guy in the world!  Oh honey, come on dont be upset. We still have so much to look forward to! |5|  Thats right. Im no longer a bride. Ill never be a bride again. Now, Im just someones wife! 
 Id better go pack. |5| Yeah! Have a great honeymoon! 
 Really? I dont like baths. |9| I just had the most amazing bath. 
 I feel violated. And not in a good way. |0| Oh, that is so sick. 
 _B_ No! |2| I dont know how to tell you this, but I think that Monicas cheating on ya! I told you that you shouldnt have married someone much hotter than you! _B_ Right, look. If you cant come home and deal with this, then I'm gonna 
 Yeah, we have all this paperwork that needs to be filed by the end of the year. If I don't get it done, I'll be fired. |0| You're really not coming back? 
 You know what? You know what? I think we're making too big a deal out of this. ok? So we pay our bills a little late this month and maybe next month we cut back on a few things. And maybe we start eating out of Joey's refrigerator for a change. You're chef... what can you make out of backing soda and beer? |6| Oh, But you're finally doing something that you love! I can't ask you to give that up. Though it'd be nice if the thing that you love was y'know... finding gold. 
 Pirates again? |6| Just for some short-term-work. You know, until I get back some of my massage clients. 
 Yes, Joey's made arrangements to have his baby in a movie from the 50's. |6| I'm gonna be in the waitin' room, handing out cigars. 
 Nothing, just a little extra air in my mouth. Pffft. Pffffffft.   |1| Pardon? 
 What? |4| Hello, I'm looking for Bob. This is Jane. I don't know if you're still at this number, but I was just thinking about us, and how great it was, and, well, I know it's been three years, but, I was kinda hoping we could hook up again. I barely had t he nerve to make this call, so you know what I did? 
 Mine is the red one! Oh God. Can open, worms everywhere. |2| Well, that was only 'cause I used the red one to unclog the drain. 
 No, look, that's it, it's over, I want you out, I want you out of the apartment now. |1| You want me to sing? 
 Ok, you can have it. _B_ |7| Give it to me. 
 I need you to come to this bachelor party for my weird cousin Albert, y'know he's the botanist. |7| Why? 
 Ye-e-es!! |9| No! Rachel, thats what they want me to do. My warranty expires tomorrow, if I dont get through, theyre not gonna fix my crappy, broken phone for free! We cannot let them win! Its us versus them! 
  Do you mind if we stick you in another cabinet?  They seem all right with it! Opening Credits _B_ |2| All right. But, youre gonna have to tell them.  
 The problem is, though, after the concert's over, no matter how great the show was, you girls are always looking for the comedian again, y'know? I mean, we're in the car, we're fighting traffic... basically just trying to stay awake. |1| Yeah, and-and it's not that we don't like the comedian, it's that-that... that's not why we bought the ticket. 
 Sorry.  |0| Sorry. 
 See? They're Joey's! J-J-J-J-J-Joey's! |4| Yeah, they're mine. 
