~~Output Dialog~~|~~Respect of User (OD)~~|~~Input Dialog~~
 Hey!!! |8| Chandler one time wore my underwear to work! 
 Yes, yes she is. Didnt I memo you on this? See, after I let her go, err, I got a call from her psychiatrist, Dr. Flanen-nen, Dr. Flanen, Dr. Flan.  |9|  Shes still here. 
 Because, if Santa and the Holiday Armadillo?  ...are ever in the same room for too long the universe will implode. Merry Christmas! |6| No! Why does he have to go? 
 Do you wanna? |6| Really?! 
 And I was a perfect gentleman and I walked her to her hotel room and said goodnight. |8| Yeah baby! 
 Well, I guess there's nothing left for us to do but-but kiss. |0| Ooh. 
 Yknow what the worse part was? I got to see what my life would be like without you. It was like Its a Wonderful Life with lap dances. Please promise that you will never leave me, that we will grow old together, and be with each other for the rest of our lives. |7| Come here. I can breath through my mouth. 
 This is the best game ever!!! _B_ |9| Yeah!! 
  Really?! The |6| All right then, well have a definite answer for you on Monday, but I think I can say with some confidence, youll fit in well here. 
 So, are you really gonna go out with that nurse man? |6| Eh!  _B_ _B_ 
 But I just wa... |4| No, but you can't. 
 She guessed 8, 9, based on his drawings.  |0|  They thought Joey was a child? 
 Oh really? |4| I didn't. 
 You too. |9|  Well, you have fun tonight. 
 Honey, it's us. Of course it's the shovel-killer. |8| Alright, we don't know that it's him. I mean, it could be the football guy. 
 I never stopped loving you. |5| Huh? 
 Yes, I know, as it happens my room is very very close to the parade route. |5| Well, it's like, last night, I couldn't do the thing that usually makes me great. So I had to do all this other stuff. And the response I got... man, oh man, it was like a ticker tape parade! 
  Yeah? |7| Chandler! 
 I, I know. _B_ _B_ |5| It's just this thing. Every year we would go out on my dad's boat and watch the fireworks. Mom always hated it because the ocean air made her hair all big. My sister Jill would be throwing up over the side and my dad would be upset becasue nobody was helping and then when we did help he would scream at us for doing it wrong. But then when the fireworks started, everybody just shut up, you know, and it'd get really cold, and we would all just sort of smush under this one blanket. It never occured to anybody to bring another one. And now it's just... 
 Janice, I have something I need to tell you, and I want you to let me get through it, because its, its, its not gonna be easy. |3| Ill get the hat. _B_ 
 I cant believe she cracked your code! |3| Joey! I cant believe you just did that! 
 We were playing Gin? Y'know if we were a couple, we could play this game naked. |3|  Gin. 
 What? |4|  I'll be right back.  What was that? 
 Yeah. |6| You do? 
 She did not have to tell me, I saw the play, and there was no heat. Back me up here, Ross! |0| Dude, tell me she actually told you this. 
 Are you all right? |9| Boy, I love carrots! Oh!  Sometimes I like to put them between my fingers like this and-and hold them down here while I talk to you.  Umm, and-and-and y'know if I get really hot umm, I-I like to pick up this knife  and-and umm, I-I put the cold steal against umm,  my body.  
 Really? |5|  Honey, I just don't think that you understood the joke. 
  Oh-oi-ho, yeah! |8| How good is that? 
 Oh my God! Someones killed Square Man! |7| Okay! , the coffee table forward , and taped a square outline on the floor.) 
 Listen, Im really glad you got the part. |9| Eh, better her than me! Hey, lets bake cookies! _B_ 
 Was the setting of Phoebes triumph. |8| But my apartment! 
 No! Youre the sweetest!  _B_ The |9| I love the way you look every night Chandler!  Thats why I made you this tape! Happy Birthday! Love Janice! 
  Before you say anything, have we got a story for you! Guess who we bumped into at dinner! |5| Oh my God, you guys!!  
 Yeah. |6| You thought about that? 
 There I am! |7|  Hey! There you are! 
 Why not? |4| No. No, no. She doesn't want to see you right now. 
 And err, he informed me that uh, she took the news rather badly, in fact, he uh, mentioned the word frenzy. Mr. |4| Yes, yes she is. Didnt I memo you on this? See, after I let her go, err, I got a call from her psychiatrist, Dr. Flanen-nen, Dr. Flanen, Dr. Flan.  
  We need the stuff. _B_ |9| Well you can have the suite if you want. We dont care about where we stay. Were here to celebrate our love together. We dont have to get free stuff. We just want to be together. 
 Which is why you should do it. |8| Hey! Its your bachelor party. 
 Go and tell Rachel right now before Ross finds out. |9| I didn’t look at it. Stupid baby’s head was blocking most of it. 
 Okay, bye, champ. Now, I know there's gonna be a lot of babes in San Diego, but remember, there's also a lot to learn. |9| Oh! 
  What? _B_ |4| Oh my god Chandler! If you can't handle this, what are you going to be like in the hospital? With the blood and the screaming and the little present that's shooting out of her!? 
 I mean, especially considering how tough it's been for you to find work. |4| Well, thanks. 
 Hey. |8| Hey. 
  I hit her in the eye! I hit her in the eye! This is the worst break-up in the history of the world. |2| Ow. Um, it's just my lens. It's just my lens. I'll be right back.  
 What are you guys doing together? |7| Hey! 
 ....And then I just, you know, threw the bag of barley at her, and ran out of the store. |3|  That's-ah what I suspected-ah. _B_ 
 Y'know what Rach, maybe you should just, y'know stay here at the coffee house. |3| This is the worst Christmas ever. 
 Hey, no way! Come on, this is you guys, call her and work it out. |7| What can I do? One person wants to break-up, you break-up. 
 Hey, you have nothing but talk about her for the last 48 hours! If you were in a school yard youd be pulling her pigtails and pushing her down now! |1| Oh.  Ohh. Ohh, youre out of your mind. 
 You dont have it. |9| Doh!!  Ive got it! 
 Hi! |9| Hi Emily! 
 All right, look! Look. I think I can explain this.  |9| No! I am not a pervert! Okay? It's just I just Kinda 
 At this?! |2| Because you're on my team! And my team always wins! 
 I need to talk to you, it's urgent! |1|  I'm Monica. 
 Yeah. |6| All right, ready? 
 Monica! This is the Men's room!  Isn't it? |9| Hi Chandler. 
 No! |2| Do you believe in ghosts, yes or no? 
 Bye! Thank God |9| Okay, listen, there's still some of Chandler's medicine under the sink in the bathroom. Bye! 
 I dont wanna know what Monica got me. Yknow? I mean, look, Im sure she worked really hard at getting you a present, and wanting to surprise me, and you guys are gonna ruin that, and I, look we have to put these back, this is not what Christmas is about. |5| Why? 
 As bad as that went, I actually enjoyed myself. I think that Im going to apologize for all of the stupid things I do. |1| No reason, Im just saying that uh Thats where Ill be.  _B_ 
 But then later that night |5| Oh. 
 Okay! Okay! Okay! You win! You win!! I can't have sex with ya! |9| Here it comes. Our first kiss.  
 Ooh, I dont know if were there yet. _B_ |6| I promise. Hey, speaking of together, how about we send out a holiday card this year? 
 Yeah I gotta say thank you, I was really nervous. Yknow Ive been told I come on to strong, make to many jokes, and then it was really hard to sidestep that duty thing.  Duties.  Duties!  Poo.  The |1| Absolutely.  You can relax; you did great. 
 Y'know, I don't know if you've ever looked up the term goofing around in the dictionary... Well, I have, and the technical definition is, two friends who care a lot about each other and have amazing sex and just wanna spend more time together. But if you have this new fangled dictionary that gets you made at me, then we have to, y'know, get you my original dictionary. I am *so* bad at this. |3| Well uh, you and I are just goofing around, I thought, why not just goof around with him. 
 Oh really!? |5| No. 
 Me too.  |9| Oh, I will. 
 I'd keep an eye on him! We have to find out which one the father is. |5| Alright, lets say that it is him, would we not want the baby? No! Would we treat him any differently? 
 Yeah, yeah, yeah! I want you... I need you... I must have you Janice Litman Goralnik Neihosenstein. |8| Oh... my... 
 I didn't know you had another level. |4| It was amazing! And not just for her... uh-uh. For me, too. It's like, all of a sudden, I'm blind. But all my other senses are heightened, y'know? It's like... I was able to appreciate it on another level. 
  Takin' that with you, huh? |1| It's really not that big!  
 Yes. Yes! Just let me grab my jacket and tell you I had sex today. |9| Geez! Are you ready? 
 I think you should go back with Gary. I dont wanna be the guy that breaks up a family, y'know when my parents split up, it was because of that guy. Whenever I would see him I was always think y'know Youre the reason, you are the reason why their not together. and I hated that guy. And it didnt matter how nice he was, or how happy he made my Dad. |3| Okay. 
 Yeah, and at the end of the play, he, he got up y'know, and he just started like,  banging his hands together! |2| No, its not just cause Im jealous.  I mean Im not, Im not, Im not jealous, okay? Its Look, the guy, he screamed, he actually screamed at this couple sitting in our seats. 
 Okay. All right. |4| Will you stop! 
 Hey, look, what do you want from me? |4| Kathy was being really nice and you just walked away. I thought we had a deal. 
 What? |4| Well, youre timing couldnt be better. Shes not my girlfriend anymore. 
 Ok, Monica, only dogs can hear you now, so, look, the door's open. Here we go.  |5| Why? Because everything is my responsibility? Isn't it enough that I'm making Thanksgiving dinner for everyone? You know, everyone wants a different kind of potatoes, so I'm making different kinds of potatoes. Does anybody care what kind of potatoes I want? Nooooo, no, no!  Just as long as Phoebe gets her peas and onions, and Mario gets his tots, and it's my first Thanksgiving, and it's all burned, and, and I... I... 
 Thats not backing me up! Look, you said with the off-stage and the heat, and the onstage and the oy heat. |5| Thats all youre basing this on? 
 I think I do!  Thank you, Monica. |9| Yeah! I mean it was really funny, I-I just don't think you got it. You see Kara's coffee is-is-is weak tasting, okay? But-but what Doug was-was imply that it was weak physically. You get it now honey? 
 My Catholic friend is right. She's distraught. You're there for her. You pick up the pieces, and then you usher in the age of Ross!  _B_ |3| Yes, now is when you swoop! You gotta make sure that when Paolo walks out of there, the first guy Rachel sees is you, She's gotta know that you're everything he's not! You're like, like the anti-Paolo! 
 Hm-hmm.  |6| See? 
 Oh thats so sweet! I want to show you something too! |9| This is where I thought the barca lounger could go! You see you could see the TV and its still walking distance to the kitchen. 
 But are you sure you can do this? |5|  Thank you. 
 Is not as important as the fact that Phoebe took care of the babies all by herself. |6| But the mess! 
  Dont try to sway her.   Im your only chance to have a baby. Okay, lets go. |0| Yeah, but Im your brother. Were family. Thats the most important thing in the world. 
 Oh my God! |4| Okay, buddy-boy. Here it is. You hide my clothes, I'm wearing everything you own. 
 Richard! |7| Who? 
 Uh, four, a boy, twin girls and another boy. |4| How many kids were we gonna have? 
 That was you! |7| Ohh! Ohh! In college, Chandler got drunk and slept with the lady who cleaned our dorm! 
 Yeah, Joey said I uh, I needed to relax so he gave me an antihistamine. |7| Are you okay? 
 This is ridiculous.  |0| Because you sent away the dog! 
 Oh, no, no. Nina...  ..she is whooo wewee-woo whoo whoo! In fact, if you asked her right now, she would have no recollection of being fired at all, none at all. Mr. |0| Youre kidding? She seems so... 
 Well, I'll stay, but only because I wanna hear about Hanukkah. Ben, will you sit here with Santa and learn about Hanukkah? |2| Fine, I-I give up. Santa, Santa can stay. 
 You do it! |9| I dont want to. You do it! 
 Okay, look, just do it gently. |7| Look, it’s not that easy. She said she wanted to marry me. I don’t want to hurt her. 
 Ooh, Lambchop. How old is that sock? If I had a sock on my hand for thirty years it'd be talking too. |8| Yeah.  _B_ 
 That's ok. _B_ |4| Hey, when the doctor does that hernia test... 
 So in your whole life, you've only been with oneoh. |8| With Carol?  Oh. 
 You know, I mean, you can't tell your parents you were fired because they'd be disappointed. |1| Well, you know. 
 Yeah me too. |9| Hey listen, I'm sorry about what happened. . . 
 Oh, I don't know, a million? |1| Oh my god.  How many of those have you had? 
 Really. |4| Joey and Janice's DAY OF FUN!!!  
 I've actually ruined this haven't I? It's time for the good ice cream now, right? |3| My God! Chandler, we said be 'aloof' not 'a doof'. 
 Hey, this isnt like swimming after you eat, pick up the phone!!  |8| Oh come on, we just had this huge fight, all right, dont I have to wait a while? 
 Uh-oh. _B_ |5| Ewwwww! 
 How do Monica and Phoebe know? |7| I have so got it. Theres gonna be rumours about this, theres no way to stop it. Sophie knows, Monica and Phoebe know. 
 Yeah, all right. |6| All right, so well get a little coffee, and get energized, and well head back out. 
 Joey's a sex addict. |4| Thank you! 
 Okay, I've been doing a lot of thinking about us, y'know a lot of uhh, us thinking. And uh, well I guess there's only one-one way to do this.  |1| Okay. 
  Okay. |5| Turn. 
 No. And if I did, I don't think we'd be going out. Monica, this is getting ridiculous! |1| Yes it is. You see I've always found the men's bathroom very sexual. Haven't you? 
 No! |2| Is this movie gonna be my big break? 
 Look, we have no time okay? We must focus. We gotta get everything back into its original place. |2| Dude, what'd you have? 
 Nobody is opening anything ok? Look, I dont know about you guys, but I wanna see the look on Monicas face when I give her my present, and Im sure she wants to see the look on my face when I get mine. So please, please, can we just, can we put them back? |1| Whatever Linus, Im opening mine. 
 Okay, so you will meet our guys? |7| All right. 
 I cant believe I let you talk me into buying this stupid gumball machine looking ring! |0|  Hey. 
 I would really love it if I could do both. |6| Why dont you just stop doing stupid things? Then you wouldnt have to apologize. 
  Hey! |8| Yeah baby! _B_ 
 Okay. Well, I think the centerpieces are too big |7| Honey, as we get closer to the wedding, is there anything that you would like to talk about or share? 
 Because I'm in love with Monica!! |8| And why not?! 
 What else is new? |3| What? Are you serious?!  Joey smells gas! 
 Oh my God this doesnt count! Okay? The interview was over, that was the real Chandler Bing in there, this is just some crazy guy out in the hall! Call security! Theres a crazy guy out in the hall! The |2| Poo? 
 Really? Okay, so... |3| I think you're better than you think you are. 
 That sounds like fun. |6| Ella wanted to go out, so we went shopping and got some sushi. 
 ADRIENNE TURNER!!  |9| NO! 
 I'm not supposed to tell you. |1| Wait a minute, I know why I'm being such an ass, why are you? 
 I dunno, aren't there tests for these things, right? |2| How? 
 Now that you live next door, we can be together every day. Sid and Monica never have to know a thing. |9| Chandler, what are you talking about? 
 Wow, it sounds even cooler when somebody else says it. I was awesome, ok? She was biting her lip to stop from screaming. |3| Whoa! You had sex today? 
  "Big guy?" |5| No? What happened, big guy? 
 Umm, this is nice. |5| Aw, God Ross. Oh. _B_ 
 Yeah, well. Its the right thing to do. |6| Wow! 
 Well seeing that drunk Santa wet himself, really perked up my Christmas.  |2| That word was swans. _B_ 
 Y'know that whole swimming thing is a myth. |4| Hey, this isnt like swimming after you eat, pick up the phone!!  
 Oh, they said uh, You dont have insurance here, so stop calling us. |0|  Hey! So ah, what did the insurance company say? 
 I am pretending. |5| I want you to like her! But if that's too damned difficult for you, then the least you can do is pretend. 
 Oh uh, when? |3| Yeah, she broke up with me. 
 Gotcha!  |9| Oh, Ill get it.  
 Oh my God!! _B_ |5| Whoa-whoa, that-that was just a theory! Theres a lot of theories that didnt pan out. The lone gunman. Communism. Geometry. 
 Coffee in a fight!  _B_ |6| I thought you could use the help. 
 I thought you were showing me how much you mean to me. |3| Oh-whoa-hey, dude, what are you doing?! 
 All right, should we just, should we just get married? Yknow? I mean should we just do it? All the signs are telling us to do it. |2| All right. Okay Chandler, enjoy your handful.  
 Yknow those big-big uh, road signs that say "Merge?" |2| Okay! 
 Now, is that never talking about it again?! |3| Yeah! And hey, thanks for coming with me. And thanks again for helping me take a shower.  
  Phoebe, would you take a look at this mess!!!! _B_ |1| Youre right, youre right I shouldnt freak out. Cause this is what will happen when you and I have babies! When will that be?! 
 Oh you knew that. Good! |8| What?  A-ohh!  Ohh. Oh thats right thats right. Thats Richards favorite place too. 
 Well, stuff like whered we live, yknow? Like a small place outside the city, where our kids could learn to ride their bikes and stuff. Yknow, we could have a cat that had a bell on its collar and we could hear it every time it ran through the little kitty door. Of course, wed have an apartment over the garage where Joey could grow old. |4| What else did you think about? 
 Yeah, and then I fell asleep on the subway and went all the way to Brooklyn. Brooklyn is f-far!! |3| What?! 
 And yet, believable. So I decided not to fire her again until I can be assured that she will be no threat to herself, or others. Mr. |4| Thats unbelievable. 
 Did you do it on our invitations?! |4|   I cannot believe that I did this. Especially after Monica just went on and on and on about it!  "Okay Rachel! Here are the invitations Rachel! Now be very careful Rachel! Please, drinking no liquids around the invitations Rachel!"  Whoa oh! Oh-oh-oh! Oh oh-oh-oh  
 All right Rock, Paper, Scissors who has to tell the whore to leave!  What? |3| You do it! 
 Everybody at my school heard it! You were the hermaphrodite cheerleader from Long Island?! |9| Everyone at our school heard it! 
 Bye! |7| Bye! 
 Bye! |7| Bye! 
 Yeah, just second.  Good-bye Mr. Heckles.  We'll try to keep it down. Ending Credits _B_ |5| You comin'? 
 And it's not as if you have a boyfriend's shoulder to cry on. |5|  Uh-huh. 
 Yeah. So do we need to hug here or. . . |8| I know. Yeah. 
 I'm fine. |6| Chandler, easy, easy. Go to your happy place. La la la la la la la. 
 Ross, dont. Ross! Monica; Ross! _B_ |9| Were kidding! 
  Go on. |0| Oh, I called them. And when they ask me what I saw, I can be very generous  or very  stingy. 
 Ahh, come on! Yknow whatyknow what, I think Im just gonna go home and call Kathy. |2| Oh! And dont let me leave without getting the name of that carpet guy. 
 What was that? |2|  Okay, that was Phoebe Buffay, everybody. Woo!  
 Okay, bye!  Oh my God!! |5| Oh, great! 
  Monica |0| Wait what-wh-wh-what are you doing?! 
 Okay, I don't think we can turn anymore! |1| Turn! Turn!  
 Ugh, we have already proved that we are hot! Okay? So why-why are you getting so obsessed about this thing?! |1| Come on, we can't let them win! 
 Yes. |6|  What?! 
 That's perfect! That's brilliant!  |9|  The photo album! There were millions of pictures of the apartment in the photo album. We just go through it and match everything to the pictures. 
  Yeah, this is so good, that Im gonna go enjoy it on the balcony so that I can enjoy the view whilst I enjoy my dessert. _B_ Mrs. |9|  Mmm. 
 Fine!  |8| Will you get us better gifts? 
 Okay, I thought of the joke two months ago at lunch with Steve. |1| Okay, Chandler, you go first. 
 Okay now it doesnt matter which one you choose, yknow? Its completely up to you. Our guy is perfect, or you can go out with the guy Phoebe deemed not good enough to go out with herself. |6| Yes, Ill meet em. 
 Joey? Got you a Joey Special, two pizzas! Joe?   Hello?  Damnit!  Hello?  No, Joeys not here right now, but I can take a message I think.  Hes still got a chance for the part?! Oh, thats great news!  Well no obviously not for the actor who was mauled by his dog.  Oh well, thats great. I will give Joey the message. Thank you!  Yes!  Okay, Mac audition at 200. Allergy actor attacked.  By dog not flowers. _B_ |3| Yeah. Whew, it's hot with all of this stuff on. I ah, I better not do any, I don't know, lunges.  _B_ _B_ _B_ _B_ _B_ _B_ 
 No, its not! When I looked at the other ring I could see Monicas face when I gave it to her, yknow? And I could see her saying yes. When I look at this ring, all I see is a ring! Unless I look at it really closely and then I can see my own eye.  Look, this is the most important thing Im gonna do in my life. I wanna make sure its perfect. |5| Its not a stupid gumball machine looking ring! Its a beautiful ring! 
 What? |4| All right, I I have to ask. 
 Monica's all upset, because I sent Clunkers away. |1|  Okay, I'm in my sweat pants. Bring on the food!  What's the matter? 
 What? |4| Oh man! 
 Well I was I wasn't exactly expecting company after  915. |0|  Cute PJs! Youre really livin it up here in London huh? 
 Kinda. Theyre really big. |3| Youre wrong! The centerpieces are fine! Do you ever get scared at all? 
 Love her! That's right, I LOVE HER!!! I love her!!  I love you, Monica. |9| You're-you're what?!  
  Chandler.  |8| So whats your name? 
 Ill look forward to your call.  _B_ |6| Poo?! 
 Y'know, I sensed that I should stop. So we're okay? |2|  Know when to stop. 
 Joey ate my last stick of gum, so I killed him. Do you think that was wrong? |0|  Hey. Where's Joey? 
 It's over/Joe! |0| Mmmm hmm! For your boob job! Monica, Rachel, 
 Would you all stop yelling in our apartment! You are ruining moving day for us!  |5| Don’t blame the questions! 
 You told us both we could be in the wedding?  |6| I'm not supposed to tell you!  
 Pff, easy for you to say, he's a father killer. He probably loves him mommy. He's probably got a tattoo that says "mom" on his shovel-wielding arm! _B_ |9| Yeah, but maybe we're just over-reacting. 
  Obviously. |4| I don't know what to say... I mean, you know, obviously we have this... heat between us. 
 Now I know it's been awhile, but I took it as a good sign.  |2| Wow! 
 You still can't stand her can you? |4| I just came by to give you a kiss, I have to go pick up the baby, so. I'll see you later sweetheart, you too Chandler.  
  Hello. Hi, Janice! Can you hold on for a second? Okay.  Okay, what do I do? |3| You know what, everything's gonna be okay.  
 Okay, on three. One....Two.... |4| Well, when I tell my friends about her she will be. _B_ 
 No, I mean it, this feels really good. Is it a hundred percent cotton? |0| I know, it is isnt it? 
 Then dont leave me! |4| Oh! Youre right. Oh God. But, before I can say good-bye, theres something I really need you to know, Chandler. The way I feel about you, its like, I finally understand what Lionel Richies been singing about. Y'know, I mean what we have, its like movie love, youre my soulmate, and I cant believe were not going to be spending the rest of our lives together. 
 Oh yeah, yeah! Look what I got, look what I got.  See, she's fully dressed, right? |1| So ah, did you have fun at the bachelor party last night? 
 Why? What happened to him? |0| Yeah, tell that to my Uncle Lenny. 
 Okay, what do you saw I go over there and say how much I like her?  No-no it'll be good, I can tell her much I've been thinking about her. That I haven't stopped thinking about her since the moment I met her. That I'm so fantastically, over-the-top, wanna-slit-my-own-throat in love with her, that for every minute of every hour of every day I can't believe my own damn bad luck that you met her first!! |4| Well then, do it better! 
 Oh man, I am so sorry. Are, are you okay? |0| Just now, after acting class. At first I thought she was doing some kind of scene, thats why I let people watch. 
 Sorry! |4| That doesnt sound like thinking to me! 
 Thanks man. |9| No, 19. 
 Me too! |9| Im sick of the signs! Its too fast, Im happy the way things are! 
 Yknow? So I was thinking that we could get one of those signs and hang it over our bed. Because, thats you and I together! Merge! |5| Uh-hmm. 
  Ahh, third base. |6| My Sweet Sixteen! Remember, you went to third base with my cousin Charlie. 
 Sure you do. |7|  Yknow what? I-I dont want a big, fancy wedding. 
 I dont know, but dont worry, dont worry, because I know how to take a picture now.  Okay, see? Look down , look down, look down  |7| Chandler, what were you thinking? 
 Well, I guess thats why they call it psychology, sir.  _B_ Soothing male |4| I see. I guess you never really know whats goin on inside a persons head. 
 Joey got meat sauce on the banister again!  |5| Yes. Yes. Just here  and there . _B_ 
 So, just the ones gave back to us and we had framed!   |7|  Not on the ones we sent out. 
 Y'know, I've had dates like this. |1| Let me see! Show them! 
 I dont think weve actually done this before! |4| I miss this. 
