~~Output Dialog~~|~~Respect of User (OD)~~|~~Input Dialog~~
 Oh yeah. Boy, urine cuts right through an ice sculpture doesnt it? _B_ |3| Thats because he wasnt invited because of the way he behaved at our engagement party. 
  Yeah well, Im gonna go spit.  |4|  Im gonna go shave.  
 Well, what did she say? |3| I know! I know it’s awful. 
 Oh, uh.. I want her to think I might be in a restaurant.. y'know? I might have some kind of life, like I haven't been sitting around here honing for the past few hours. |6| What was with the dishes? 
 But, those are for you. _B_ |6|  
 So how come Richard's selling the place? Went bankrupt? Medical malpractice? Choked on his own moustache? |1| Hi I'm Joey. This is Chandler. 
 So what do you think? I want that guys genes for my kid! Those eyes, those cheeckbones! |5| Oh! I'm gonna go wash up first.  Thanks! 
 Why come all the way from Kansas to do that? |4|  Did someone drop the baton again? 
  I don't think that's exactly... |3| You're kidding me? I mean, it's enough that you are a doctor. But on top of it, you're married to a reverend? 
 Not yet. |5| Did you talk to him? 
 Oh, uh, he's not here right now, uh, I'm Chandler, can I take a message, or, or a fishtank? |1| I'm looking for Eddie Minowick. 
 Do I look fat? Ross and |8| Hey. 
 Oh! It's on! It's on!  |9| Oh my God! 
 Uh yes, but uh, I just watch it for the articles. |2|  Hey!  Oh God, is that Baywatch? 
 You're on in 5 Ms. Minnelli. |7| Ooh-ooh-ooh, yeah!  Enh? All right, what do you think? 
 Oh I used too, but then Joey thought it would be fun to go to Central Park and hit rocks at bigger rocks.  Hey Rach, do you have a tennis racquet? |9| Hey, I thought you already had one. 
 Which is why Asteroids is perfect! Its the oldest game! |9| I just dont think arcade games go in the beautiful guest room. The beautiful guest room is gonna be filled with antiques. 
 Boy did we make friends with the wrong sister!  |5| Yeah but it wasnt for me, it was for a friend. 
 Nothing, I just like to go like this.  |5| What? 
  Would you put that back on?! Monicas gonna be here any minute! |1| Werent you asked to leave sonny? _B_ 
  Uh, uh. |0| What is it? Is there something fundamentally unmarriageable about me? 
  Monica! Can I talk to you for a second? Listen, I appreciate you getting me the costume |8| No, its me. Phoebe! 
 Who says you cant get a nice punch bowl for under six bucks? Maybe we can take it back? |2| Hi honey. We just got a wedding gift from Bob and Faye Bing; they dont like us do they?  
  Hey! |8| What are they doing out here? The coasts all the way over there.  _B_ 
 What does a Wicked Wango card do? |5| Its Ba-go-ta, but close enough. Now, you can either pass your turn to Ross or pick a Wicked Wango card. 
 No, I have a great idea for a present for her. |5| Chandler, aren't you worried about what to get Monica for Christmas? 
 Ooh.  _B_ |8| Whatcha doin'? 
 Someone I don't know sent me an e-mail and I opened it. |0| What, oh my God. What did you do? 
 Someone I don't know sent me an e-mail and I opened it. |0| What, oh my God. What did you do? 
 He's not right for the part. So if I suggest him, my bosses are gonna think I'm an idiot! And that's something they should learn on their own! |0| Just pass it to your boss! 
 And the fireplace in the bedroom. |9| Don’t you love the huge yard? 
 I said it first, bro. |5| Dude, I was gonna ask her out. 
 The mean guys at the coffee house took my hat. |1| What's the matter with you? 
 Yes because uh, you look so young. |3| You thought I was Rachel? 
 Who's Rick? |1| Who's Rick? 
 Hey, Mon. |9| Hey!  _B_ 
 it was like the Algonquin kids table.  _B_ The |3| Nooo!!  _B_ 
 Why dont you just give him to somebody else? |2| No, I made myself take an oath. Yeah, no fooling around with clients and umm, always be prepared. Yeah, that ones actually from the Boy Scouts, but it just makes good sense. 
 There we go little fella. |6| Oh! It's on! It's on!  
 Oh man! I am so excitedI may vomit! |0| Kidding! God, I feel wild today! _B_ 
 Oh-oh, oh, oh-oh!  |9| Okay, the last thing 
 Happy Anniversary, 10 months!  |8|  Hey! Happy Anniversary! 
 Thank you. |9| Chandler! You don't have to ask for my permission.  You can go. 
 Huh. |5| Awww! Now you're just my annoying friend Chandler. 
 So, has anyone talked to Dr. and Mrs. Geller yet? |7| Hey. 
 Well appealing as that does sound to her boyfriend  and her brother,  I cant do that we promised wed make each other gifts this year. |7| And of course, crotchless panties. 
 So it did go well. |3| Totally! 
 Yknow what? Its gonna be okay. Yknow what? Shes probably not gonna even want to come. |0| Oh my God, shes not gonna like the chicken that night either, is she?! 
  Hi, could we get two burritos to go, please?  |8|  No! Drums! _B_ 
 I cant seem to say goodbye. |2| So just bring it back downstairs, whats the problem? 
 No? |6| Honey, Im going to put my hand in your pocket! 
 Does Ross know? |8|  She said yes. 
 mmm That's enough about you! |7| Actually, he is buying a much bigger place. It's got a great view of Central Pa..... 
 Wow. |7| Oh my god. 
 You don't like him. |5| Ok, there's enthusiastic and there's just plain gay!! 
 You know what just occurred to me? This could be our last Thanksgiving just the two of us. I mean, we could be getting a baby soon! |3|  I don't get older. I just get better! 
 I know. *He* always wanted to be the first black man to cross the Atlantic. |2| Joey's gonna be *so* upset. 
 So what the hell happened to you in China? I mean, when last we left you, you were totally in love with, you know. |1| Then, no.  
 Oh, oh, c'mon in. |0| Thanks. 
 I was just telling Joey about the opening in Fleischman's group. |5| Uhh, well, right now I'm in between things. You know how it is. One day you're processing, the next day you're not so much... processing any more. 
 Okay, I accept that. When Janice asked me and I said no, she took that to mean that I was calling her a cow. |1| Noo. 
  Joe. Joe! Answer the phone. |7| I'm sorry, it just felt nice. 
 No, you didnt get me!! Its an electric drill, you get me, you kill me!! |8| Oh, Im sorry. Did I get ya? 
  Oh my God! |4| Chandler!! 
 Hey, gorgeous. |9| I'd like that. _B_ 
 No-no, hes not back yet, but hell be here any minute. So uh, come on in. Have a seat. Bow or stern? |0| So is Joey around? 
 Oh yknow what, I was already trying to trade for ah, well, you. |0| So listen ah, I picked Monica for secret Santa, but Im already getting her something for Chanukah, I was wondering if you wanna switch. 
 Oh, yeah, sure, its not mine anyway. It can with the pants. |3| Umm,  I love this touchy. Can I take it to work with me? 
 Yeah we do! |9| Yeah! 
 You don't get a lot of 'doy' these days... |4| Doy! Probably right before she lost it! 
 THAT'S TOO MUCH INFORMATION!! Jay |3|  ...I just get this craving for Kung Pow Chicken. 
 Okay, good luck with that.  |2| Oh umm, y'know I lent it to Joey and I never actually got it back. 
 I dont have anything against the beautiful guest room, especially since everybody we know lives about 30 seconds away! |5| What do you have against the beautiful guest room? 
 Oh, thats Parents Day, first grade. Thats me with the janitor Martin. |3| All right, whats going on there?  
 Will you marry me? Will you marry me?  Hey, you marry me!  Whats going on little elves? |7| See? Now, he could date her. _B_ 
 Uh why, do you have a lecture? |1|  Hey Chandler, what are you doing tonight? 
 I don't know. Maybe it's because it smells a little weird. It's like old pumpkins or something. |2| Rosss apartment is nice! How come we don't hang out here more often? 
  Okay, for the last time. Its not named for each individual man.  Mrs. |6| But it hurts my Joeys Apple. 
 Dear God! This parachute is a knapsack!  _B_ |6| Well? 
 How about to the street say from the balcony? |5| No, it doesnt say where it came from. Where would we return it? 
 Higher or lower than what? |3| I should know that. Lets see, just one moment please. Umm, here we are, a Wicked Wango card determines whether you go higher or lower. 
 Well, it didn't say "This is a virus"!! |3| Why, why would you open it? 
 Well, it didn't say "This is a virus"!! |3| Why, why would you open it? 
 That's good! I liked it, they didn't.  Joey, for God's sake, go to work! . |2| Just tell Joey that you watched the tape and you liked it, but your bosses didn't. Then that way, you're the good guy and they're the bad guys. 
 This is bringing out a lovely color in you! |9| And Nancy said that it's really under price, because the guy lost his job and has to move in with his parents! 
  Look, if you did... |1| Well, I thought it first, Holmes. 
 Uh-Oh. It's Isaac Newton, and he's pissed.  Mr. |0| Well, it's not so much that you know, like I don't believe in it, you know, it's just...I don't know, lately I get the feeling that I'm not so much being pulled down as I am being pushed.  
 Oh, come on. I can never get a girl like that with conventional methods. |4| I'm tellin' you. You can't do this. 
 So, whaddya say boys, should I call him? _B_ Well, ya know what they say. Ask your slippers a question... you're going crazy. _B_ |5| _B_ I've never wanted you more. _B_ 
 Do I ever. |1| Hey-hey-hey. You wanna hear something that sucks. 
 Well the duck can swim. |2|  What about the duck? 
 Look you dont understand, Gandolf is amazing. Yknow youre never know whats gonna end up happening, you go out for a couple of beers and end up on a fishing boat to Nova Scotia! |9| Will you calm down, hes just a human guy. 
 I got it! Scotch tape.  |6| No-no, not for like another two weeks. 
 So uh, man, are you gonna go to the play with me tonight? |4| Noooo!! _B_ 
 Say Ross, when you picture Phoebe living on the street, is she surrounded by the entire cast of Annie? |8| Really?! So what would you say Pheebs? Stuff like uh, "Keep your mitts off my grub?" 
 Uhh, Joey's grandmother is right there.  |7| So umm, when I was in the shower I was thinking about our first night in London 
 Oh, but it's not 'til tomorrow! |2| I got you a present! 
 Was it formerly owned by a blonde woman and some bears? |4| So great! He showed me where the restaurant's going to be. It's this, it's this cute little place on 10th Street. Not too big, not too small. Just right. 
 No! That was a lie! See how easy that was? |2| Really? 
 Forty-five minutes? We have tickets to the Musicman at 800. Maitre d' I'm sorry. Christmas is a very busy time, sir. |4| I'm sorry. But not that sorry, 'cause you don't have to live with it. Um, we have a reservation under the name Chandler Bing. Maitre d' Oh-kay, we'll have a table for you in about 45 minutes. 
 Well Ive forgotten what it tastes like okay?! |5| Are you serious?! Chandler, we ate an entire cheesecake two days ago and you want more? 
 Shhhhhhhhh!!!  Im sorry, I thought maybe Id make some warm milk and it would help me sleep. |0|  I know, I wasnt finished.   But dont worry! Were gonna go down the fire escape!! _B_ 
 Ive been taking dancing lessons. |7| No. 
 The Velveteen Rabbit was brown and white! |3| What?! I thought hed love it! His favorite kid's book was the Velveteen Rabbit! 
 You can wear them with shorts on a street corner and earn the money to pay for them.  |6| See Chandler? Im getting a lot of use out of them already! Theyre very practical. See, you can wear them with dresses, with skirts, with pants 
 Well, I see you've had a very productive day. Don't you think the cowboy hat is a little much? |8|  Dude! What are yoyou trying to kill me?! _B_ _B_ 
 Well maybe you don’t have to tell him anything. |2| Oh God, what the hell am I going to tell him? 
 If I help, we can find 'em faster! |0| Chandler, that's not enough. I mean what if she gets you a great present, two medium presents, and a bunch of little presents? And you've just gotten her one great present? I mean that's just gonna make her feel bad. Why would you do that to her Chandler? Why? Why? 
 Alright! Just follow my lead!  |8| I think he is fine! It's just that we don't know anything real about him... we should get more information. 
 And she's... turning on the TV... and watching... Miss Congeniality! |3| That's the door. He's gone... 
 Somebody is gonna pick us. |4| You don't know that. 
 God? |4| I know, I know I was, but there was always this little voice inside that kept saying it's never gonna happen, move on. You know whose voice that was? 
 Oh. |5| I'm Tilly. 
 NO! No, I'll take that for ya. MRS. |1| Oh, I missed you kids. Well, should I put my coat in the bedroom? 
 Okay, well. Janice said 'Hi, do I look fat today?' And I, I looked at her.... |2| Okay, walk us through it, honey, walk us through it. 
 Oh, so you're divorced? |3| Ooooohhh. 
 Just do it! Okay, it's Janice and if I get it I'm going to have to see her tonight.  Oh, that's great I'm gonna have to see her tonight. |4| Hey, I only got one good arm, you know. You should be doing stuff for me. Go get me a sweater. 
 I do NOT want this unit!! |1| Calm down, do you want this unit or not? 
 Well, actually, yesterday I was smoking again. Today, Im, Im smoking still. |5| Youre smoking again?! 
 No, nono, don't- don't worry about it. Believe me, apparently other people have made the same mistake. |3|  Hey. Look, I'm sorry about yesterday, I, um- 
 Yes, but theres two in martini, soo everybody back to my office. |6| So thanks for the warm welcome. Its good to have you guys on my team, and I come to play. I hope you do too. Now, lets go out there and get em! Huh? And remember, there is no I in team. 
 I like it in the stern.  of the boat.   Hello. |9| I uh, dont really have a preference. You? 
 I dont know R.G., I was thinking something girlie for your office. |2| Really?! Wow! Thats-thats so nice, what are you gonna get me? 
 Oh well, thats uh, a little later than I uh, generally care to stay, but sure! |3| Hold on, yknow I just got a box of Cubans, maybe I bring them by your office around uh, five? 
 Yknow, I cant believe Kathy did this too me. I really, thought that she was the one. I tell you what, from now on Im never getting out of this chair, ever! Okay? From now on, this chair is the one! You wanna what else is the one? My sweat pants! |2| Oh yay! _B_ 
 Wait a minute, wait a minute, I see where this is going, you're gonna ask him to New Year's, aren't you. You're gonna break the pact. She's gonna break the pact. |6| Well, he's kinda like the guy I went to see that with. Except, except he-he's smarter, and gentler, and sweeter... I just- I just wanna be with him all the time. Day and night, and night and day... and special occasions... 
 ...Dinah? |0| I know I had it this morning, and I know I had it when I was in the kitchen with... 
 Its a buffet man. |8| Where is the waitress?! Im starving! 
 No, Im not mocking you,  or you beautiful guest room.  _B_ |8| Are you mocking me? 
 Oh they didnt want to come! |6| Where were your parents? 
 Oh thats great! |9| Great! 
 Then free as a bird. Whats up? |7| No, why? 
 Which smells delicious! |9| That's my pie! 
 Is this because of the burrito thing? |3| Forty-five minutes? We have tickets to the Musicman at 800. Maitre d' I'm sorry. Christmas is a very busy time, sir. 
 Oh well, not as lovely as you. I mean, I cant believe that you would have a thirty-year-old daughter!  And you! I cant believe that you would have a tux thats thirty years old!  Mr. |6|  Youve done a wonderful job with this party Chandler. Everything looks so lovely. 
 Okay. How about in that cabinet? |3| Why dont we just find a place for it? 
  Can you believe how lame this is? |0| This is embarrassing.  
 No, no, no, no, no, NO! No, no... we're not together. We're not a couple. We're definately not a couple. |0| All the appliances are included. There is a lot of light, a new kitchen... I think you guys would be very happy here...  
 Nude... ... pictures of Anna Kournikova. I'm so sorry. |1| What did it say? 
 Nude... ... pictures of Anna Kournikova. I'm so sorry. |1| What did it say? 
 I don’t know. What do you think? |4| So? Do you think we should get it? 
 Totally. I had sex in High school... |2| Woha! Wait... What are we doing? What we have is too important to mess it up over some girl. I mean, we can get laid anytime we want. 
 We don't know Bob! Okay? We know me. We like me. Please let me be happy. |4| That doesn't matter. She wanted to call Bob. Hey, for all we know, Bob is who she was meant to be with. You may be destroying two people's chance for happiness. 
 You know, I don't think we brought enough stuff. Did you forget to pack the baby's anvil? |3|  Lather, rinse, repeat, and lather, rinse, repeat, and lather, rinse, repeat...as needed. _B_ 
 I know, this is a great apartment. |8| Can you believe this place? 
 Hey. |8| Hello. 
 No way! |4| Chris says theyre closing down the bar. 
 Because thats the only part of you he can see when hes on the table! |2| Wow! And you got a petticure. Your feet are all dressed up. 
 Oh yeah, its beautiful country up there. |8| Really?! 
 Well, we used theres up last night making scary faces. |2| How did you know she would buy scotch tape? 
 Yeah, I know but |4| Yknow what, I dont know how comfortable I am going to see how hot the sex is between some guy and your girlfriend. 
  Hey Monica, here's your broom back. |7| Oh no, it is okay, I mean as long as you know that Chandler and I are also very hot and fiery, just as hot as you! I mean our flame, whew, is on fire! 
 The one that doesn't. |2| Is that the one that speaks English or the one that doesn't? 
 Okay.  |5| I know, but you have to open it today!  
 Why dont you open with a joke? |0| Ohh! Okay! Okay.  "There are three  primary theories concerning sediment flow rate.   Each of these theories  can be further subcategorized  into " 
 Yeah all right.  Okay, good night guys. |8| Nope-op! I insist!  You get the wine right? 
 Yeah. |6| You forget how many great songs Heart had. 
 Yeah. Do we have any Fruit Roll-Ups? |5| Chandler, do you think we talk about our relationship enough? 
 Yeah, right here in my pocket.  Pheebs? |8| Yeah, yeah you have the ring? 
 Yes!! |8| So-so you wouldve just lied? 
  Yknow what? Forget it! We are just hungry! We have not had lunch! We are just light-headed! So let us go out and have lunch and forget about the cheesecake. |5| It was cheesecake. It was fine. It had a buttery, crumbly, graham cracker crust, with a very rich yet light, cream cheese filling  Wow! My whole mouth just filled with saliva! 
 It got interesting! Damn you Oprah! |5| With a wok?  I thought you were going to read my boring book to put you asleep. 
 Guys thank you very much but neither of you is marrying us. |8| What?! No! It was my idea! 
 Nice try. |3|  Do you think he knew I was here?  _B_ 
 Yeah, the last six weeks. I wanted this to be a moment you will never forget. |5| What?! 
 No bunny at all!! Always no bunny at all!!! |0| Well, it was either a pink bunny or no bunny at all. 
 I know its tough now, but things will get better. |3| So I thought Joey and I would be okay once we hung out, but its not even like we know how to be with each other anymore. 
 All right!  Isn't this a woman's hat? |3|  Come on, it's fun! 
 If you clear things up with Rachel then Ross never needs to find out, but you have to do it now before he hears about it and kicks your ass! |6| Oh, I like that. Yeah… 
 Well, I think it's great that you're going on a date, you know? I mean, it sounds healthy. I mean, you have needs. Embrace your womanhood! |8| What, slept together a year and a half ago? Yeah, I'm all set. 
 No. |4|  Damnit! anybody got anything? 
 Oh! Thanks, I'm crazy about our place. Hey! speaking of crazy... do you have a history of mental illness in the family? |9| You guys have such a great place here. 
 I'm telling ya! It's gonna happen. Next year it's gonna be you, me and the little Hemingway Bing.  What, he's my favourite author! |9| Yeah, but we haven't heard a thing from the adoption agency and it has been weeks! 
  You know what I just realized? We have no idea what we're doing in the wedding tomorrow. |3| Hey, I'm not that fond of you either, ok buddy? But I'm just trying to be nice for the kids!  
 Well, maybe it was God, doing me. |5| It was you, pal. 
 No, no the gravel capades. Yeah, the turns aren't as fast but when Snoopy falls. . . funny. |1| The Ice Capades? 
 Oh yeah, your uh, name came up in a uh, conversation that terrified me to my very soul. |6| I gather by that oh that he told you about me. 
 Hey. |8| Yeah, I talked to my grandma about the Old Yeller incident, and she told me that my mom used to not show us the ends of sad movies to shield us from the pain and sadness. You know, before she killed herself. _B_ 
 Oh, I'm sorry, then you're widowed?...Hopefully? |0| No. 
 Okay, last night at dinner, when the meals came, she put half her chicken piccata on my plate and took my tomatoes. |3| What's the big deal? Why don't you wanna see Janice? 
 Fine!  _B_ |8| Well, you shouldve told me that before, Im not a mind reader. Hey, were out of beer. Im going to Monicas. 
 Look, Im telling you this is just like my parents divorce, which is when I started smoking in the first place. |3| Why would you start again after chewing all that quitting gum? 
  And is this in case the house sneezes? |7| Well, maybe its so big because the house was built on radioactive waste. 
 So, uh... what do you think it is about me? |3| Oh! Okay! Phew! 
 Oh its Bing, sir. Im sorry , I was just ah... |0|  You! Chuckles! Whats your name? 
  Let it go!! _B_ |7|  Dude, Phoebes mom has got a huge peni... 
 What happened? |0|  Hey, its me. Listen Casey and I were on our way back and had a little car trouble. 
 Oh no-no-no, you dont want to do that, then youre gonna get stuck with Rachel and she exchanges every gift she ever gets. |2| Yeah, well maybe Phoebe will switch with me. 
 Well, I dont really know what that is, but lets!! _B_ |4| Maybe, before the game we could enjoy some eight year old some small batch Basel Hadens. 
 Yes. Right where? |5| You guys are really right there arent you? 
 Yeah, 'cause I already asked Janice. |8| No, no, no, no, no, no. Yeah, could I just? 
 This is the way that I find out. Most moms use the phone. Jay |5| Awww! 
 Listen, I gotta talk to you. |6| Oh, heres where I win all my money back!  
 Nothing, Monica and I had a stupid fight. |0| Hey, whats up? 
 Oh nope, I-I have plans with Joey. |7|  Okay! The movers will be here in 11 hours. Rachel has not packed. Now, everybody has to help! Chandler, were gonna start with 
 Yeah, I thought so to until I paper mached one of my eyes shut. |8|  Okay-okay-okay! So, making things. That sounds like so much fun. 
 Oh my God! |4| Yeah-yeah, its down to me and two other guys. 
 What? |4| Uh-oh! Uh-oh! 
 Give him money? It was a joke! |0|  You need to give him money. 
 Ohh!  |8| Its older than that. Ross was actually conceived right near this tuxedo. 
 Yknow who has a great video camera? |8| Yeah! You gotta tell a girl before you tape her. Such a rookie mistake. 
 How about the closet by the bathroom?  |2| No! Thats where we keep the canned goods! Have you completely forgotten everything you learned at orientation? 
  Why did you get me this? |1|  Ive still got it! 
 It's not gone! I mean, I'm sure you printed out a copy. You have a hard copy, right? |0| What... what am I gonna do? My speech is gone, Chandler! 
 It's not gone! I mean, I'm sure you printed out a copy. You have a hard copy, right? |0| What... what am I gonna do? My speech is gone, Chandler! 
 But you already gave all your money to charity! |1| Yay! 
 I do too. |9| I think we should. 
 All right, I'd say we make a pact. Neither of us will go out with Missy Goldberg. |3| Me too. I'm good at it. 
 Unless Snoopy says it to Charlie Brown, I think we're okay. _B_ Mr |1| What if he reads it in the paper? 
 All right.  |5| Go over there and tell that woman the truth. 
 No, I got him. |3| It's gonna be worth it. It's a known fact that women love babies, all right? Women love guys who love babies. It's that whole sensitive thing. Quick, aim him at that pack o' babes over there. Maybe one of them will break away. No, no wait, for get them, we got one, hard left. All right, gimme the baby. 
 Wow, there's my fantasy come true. No, seriously. JOEY'S CO-|6| Ah, I was just in the bathroom, and there's mirrors on both sides of you. So when you're in there it's like you're peein' with the Rockettes. 
 Listen, I'm, I'm sorry I didn't make it over there today. |0| Hey! 
 Just coffee! Where are we gonna hang out now? |5| Yeah, apparently theyre turning it into some kinda coffee place. 
 Well, she spent the last six months getting over him, and now shes celebrating that by going on a date with him. |2| Monica, what are you doing? 
 If that doesnt keep kids in school, what will? |3| Ohhh.  
 Its not gonna be exactly like last time. |3|  Hey! Okay! I got my passport, fresh socks, and a snake bite kit! 
 All right! Ten buck! Fork it over! Cough it up! Pay the piper! Gimme it. |3| Aww, man! 
 Are you serious? |2| Boy! I didnt see that coming! 
  I can't believe it! We're here! |7| I know it's le poo right now, but it'll get better. _B_ 
 So you're really okay with this? |2| That's way uptown! That's like three trains away!  Which is great! I love to ride that rail! 
  Hello children! |9| And then. I would use y'know the strongest tool at my disposal. My sexuality. 
 Ok, so it's just because it was my table, I have to buy a new one? |0|  Uh, never mind, I don't want to know.  _B_ 
 Oh hey, how'd the interview go? |6| You are so cute.  _B_ 
